{"contract":"grid.bybit-1m-history-request/v1","job_id":"trade-2026-04-b05-compact-g03","kind":"trade","series":[{"symbol":"SEIUSDT","start_ms":1775001600000,"end_ms":1777593540000},{"symbol":"MNTUSDT","start_ms":1775001600000,"end_ms":1777593540000},{"symbol":"BIGTIMEUSDT","start_ms":1775001600000,"end_ms":1777593540000},{"symbol":"STEEMUSDT","start_ms":1775001600000,"end_ms":1777593540000},{"symbol":"10000SATSUSDT","start_ms":1775001600000,"end_ms":1777593540000},{"symbol":"USTCUSDT","start_ms":1775001600000,"end_ms":1777593540000},{"symbol":"PIPPINUSDT","start_ms":1775001600000,"end_ms":1777593540000},{"symbol":"ZETAUSDT","start_ms":1775001600000,"end_ms":1777593540000},{"symbol":"BOMEUSDT","start_ms":1775001600000,"end_ms":1777593540000},{"symbol":"TNSRUSDT","start_ms":1775001600000,"end_ms":1777593540000}],"page_limit":1000,"workers":24,"target_rps":15,"max_attempts":3,"max_http_requests":100000}
