{"contract":"grid.bybit-1m-history-request/v1","job_id":"trade-2026-04-b05-compact-g05","kind":"trade","series":[{"symbol":"ANIMEUSDT","start_ms":1775001600000,"end_ms":1777593540000},{"symbol":"EPICUSDT","start_ms":1775001600000,"end_ms":1777593540000},{"symbol":"PARTIUSDT","start_ms":1775001600000,"end_ms":1777593540000},{"symbol":"FHEUSDT","start_ms":1775001600000,"end_ms":1777593540000},{"symbol":"CLANKERUSDT","start_ms":1775001600000,"end_ms":1777593540000},{"symbol":"SOPHUSDT","start_ms":1775001600000,"end_ms":1777593540000},{"symbol":"SQDUSDT","start_ms":1775001600000,"end_ms":1777593540000},{"symbol":"USELESSUSDT","start_ms":1775001600000,"end_ms":1777593540000},{"symbol":"USD1USDT","start_ms":1775001600000,"end_ms":1777593540000},{"symbol":"MYXUSDT","start_ms":1775001600000,"end_ms":1777593540000}],"page_limit":1000,"workers":24,"target_rps":15,"max_attempts":3,"max_http_requests":100000}
