{"contract":"grid.bybit-1m-history-request/v1","job_id":"trade-2026-04-b05-compact-g01","kind":"trade","series":[{"symbol":"BTCUSDT","start_ms":1775001600000,"end_ms":1777593540000},{"symbol":"UNIUSDT","start_ms":1775001600000,"end_ms":1777593540000},{"symbol":"FILUSDT","start_ms":1775001600000,"end_ms":1777593540000},{"symbol":"CHZUSDT","start_ms":1775001600000,"end_ms":1777593540000},{"symbol":"EGLDUSDT","start_ms":1775001600000,"end_ms":1777593540000},{"symbol":"WOOUSDT","start_ms":1775001600000,"end_ms":1777593540000},{"symbol":"SLPUSDT","start_ms":1775001600000,"end_ms":1777593540000},{"symbol":"IMXUSDT","start_ms":1775001600000,"end_ms":1777593540000},{"symbol":"CVCUSDT","start_ms":1775001600000,"end_ms":1777593540000},{"symbol":"XMRUSDT","start_ms":1775001600000,"end_ms":1777593540000}],"page_limit":1000,"workers":24,"target_rps":15,"max_attempts":3,"max_http_requests":100000}
