{"contract":"grid.bybit-1m-history-request/v1","job_id":"trade-2026-04-b05-compact-g04","kind":"trade","series":[{"symbol":"VELOUSDT","start_ms":1775001600000,"end_ms":1777593540000},{"symbol":"TAIKOUSDT","start_ms":1775001600000,"end_ms":1777593540000},{"symbol":"ZROUSDT","start_ms":1775001600000,"end_ms":1777593540000},{"symbol":"ZEREBROUSDT","start_ms":1775001600000,"end_ms":1777593540000},{"symbol":"ARCUSDT","start_ms":1775001600000,"end_ms":1777593540000},{"symbol":"RENDERUSDT","start_ms":1775001600000,"end_ms":1777593540000},{"symbol":"POLUSDT","start_ms":1775001600000,"end_ms":1777593540000},{"symbol":"SONICUSDT","start_ms":1775001600000,"end_ms":1777593540000},{"symbol":"BANUSDT","start_ms":1775001600000,"end_ms":1777593540000},{"symbol":"CHILLGUYUSDT","start_ms":1775001600000,"end_ms":1777593540000}],"page_limit":1000,"workers":24,"target_rps":15,"max_attempts":3,"max_http_requests":100000}
