{"contract":"grid.bybit-1m-history-request/v1","job_id":"trade-2026-04-b05-compact-g02","kind":"trade","series":[{"symbol":"KAVAUSDT","start_ms":1775001600000,"end_ms":1777593540000},{"symbol":"QNTUSDT","start_ms":1775001600000,"end_ms":1777593540000},{"symbol":"BANDUSDT","start_ms":1775001600000,"end_ms":1777593540000},{"symbol":"APEUSDT","start_ms":1775001600000,"end_ms":1777593540000},{"symbol":"CVXUSDT","start_ms":1775001600000,"end_ms":1777593540000},{"symbol":"ONTUSDT","start_ms":1775001600000,"end_ms":1777593540000},{"symbol":"COREUSDT","start_ms":1775001600000,"end_ms":1777593540000},{"symbol":"SSVUSDT","start_ms":1775001600000,"end_ms":1777593540000},{"symbol":"SUIUSDT","start_ms":1775001600000,"end_ms":1777593540000},{"symbol":"XVGUSDT","start_ms":1775001600000,"end_ms":1777593540000}],"page_limit":1000,"workers":24,"target_rps":15,"max_attempts":3,"max_http_requests":100000}
